[
  {
    "id": "network-py-course",
    "name": "Learn Network in Python — The New Science of Maps",
    "url": "https://www.thenewscienceofmaps.com/courses/network-py",
    "primary_category": "learning_research",
    "role": "Curso/recurso formativo para aprender análisis de redes en Python.",
    "interfaces": [
      "web",
      "course"
    ],
    "network_types": [
      "network_science",
      "python",
      "learning"
    ],
    "scale_profile": "not_applicable",
    "maturity": "educational_resource",
    "cost_model": "verify_current_terms",
    "verification_status": "primary_url_selected",
    "source_origin": "user_provided",
    "notes": "Verificar currículo, accesibilidad y condiciones de acceso antes de recomendarlo para un objetivo de aprendizaje concreto."
  },
  {
    "id": "gephi",
    "name": "Gephi",
    "url": "https://gephi.org/",
    "primary_category": "desktop_exploration",
    "role": "Exploración visual interactiva, layouts y análisis exploratorio de redes.",
    "interfaces": [
      "desktop"
    ],
    "network_types": [
      "general",
      "social",
      "citation",
      "infrastructure"
    ],
    "scale_profile": "small_to_large_with_layout_limits",
    "maturity": "established",
    "cost_model": "open_source",
    "verification_status": "primary_url_selected",
    "source_origin": "user_provided",
    "notes": "Buen punto de partida para explorar redes y producir vistas; el rendimiento depende del tamaño, el layout y el equipo."
  },
  {
    "id": "cytoscape-desktop",
    "name": "Cytoscape",
    "url": "https://cytoscape.org/",
    "primary_category": "desktop_exploration",
    "role": "Análisis y visualización de redes con un ecosistema de apps, especialmente útil en biología.",
    "interfaces": [
      "desktop"
    ],
    "network_types": [
      "biological",
      "molecular",
      "semantic",
      "general"
    ],
    "scale_profile": "small_to_large_with_task_specific_limits",
    "maturity": "established",
    "cost_model": "open_source",
    "verification_status": "primary_url_selected",
    "source_origin": "user_provided",
    "notes": "Su orientación biológica es fuerte; también sirve para redes generales."
  },
  {
    "id": "graphia",
    "name": "Graphia",
    "url": "https://graphia.app/",
    "primary_category": "desktop_exploration",
    "role": "Visualización y exploración interactiva de redes complejas y datos científicos.",
    "interfaces": [
      "desktop"
    ],
    "network_types": [
      "biological",
      "scientific",
      "attributed"
    ],
    "scale_profile": "medium_to_large",
    "maturity": "established",
    "cost_model": "open_source",
    "verification_status": "primary_url_selected",
    "source_origin": "user_provided",
    "notes": "Evaluar formatos admitidos y límites de memoria con el dataset real."
  },
  {
    "id": "tulip",
    "name": "Tulip",
    "url": "https://tulip.labri.fr/",
    "primary_category": "desktop_exploration",
    "role": "Entorno extensible para visualización, análisis y desarrollo de herramientas sobre grafos.",
    "interfaces": [
      "desktop"
    ],
    "network_types": [
      "general",
      "scientific",
      "attributed"
    ],
    "scale_profile": "medium_to_large",
    "maturity": "established",
    "cost_model": "open_source",
    "verification_status": "primary_url_selected",
    "source_origin": "user_provided",
    "notes": "Adecuado cuando importan extensibilidad y algoritmos, no solo una vista rápida."
  },
  {
    "id": "nodexl",
    "name": "NodeXL",
    "url": "https://nodexl.com/",
    "primary_category": "desktop_exploration",
    "role": "Análisis de redes sociales integrado con hojas de cálculo y flujos de trabajo de Office.",
    "interfaces": [
      "desktop_addin"
    ],
    "network_types": [
      "social",
      "organizational",
      "communication"
    ],
    "scale_profile": "small_to_medium",
    "maturity": "established",
    "cost_model": "verify_current_terms",
    "verification_status": "primary_url_selected",
    "source_origin": "user_provided",
    "notes": "Verificar compatibilidad, edición y modelo de licencia actuales antes de adoptarlo."
  },
  {
    "id": "socnetv",
    "name": "SocNetV",
    "url": "https://socnetv.org/",
    "primary_category": "desktop_exploration",
    "role": "Herramienta de análisis de redes sociales con visualización y métricas de red.",
    "interfaces": [
      "desktop"
    ],
    "network_types": [
      "social",
      "organizational",
      "general"
    ],
    "scale_profile": "small_to_medium",
    "maturity": "established",
    "cost_model": "open_source",
    "verification_status": "primary_url_selected",
    "source_origin": "user_provided",
    "notes": "Útil para análisis social de escritorio sin construir un pipeline de código."
  },
  {
    "id": "ucinet",
    "name": "UCINET",
    "url": "https://sites.google.com/site/ucinetsoftware/",
    "primary_category": "desktop_exploration",
    "role": "Paquete clásico de análisis de redes sociales.",
    "interfaces": [
      "desktop"
    ],
    "network_types": [
      "social",
      "organizational"
    ],
    "scale_profile": "small_to_medium",
    "maturity": "established",
    "cost_model": "commercial",
    "verification_status": "primary_url_selected",
    "source_origin": "user_provided",
    "notes": "La URL del proyecto puede cambiar; confirmar licencia, versión y sistema operativo."
  },
  {
    "id": "vosviewer",
    "name": "VOSviewer",
    "url": "https://www.vosviewer.com/",
    "primary_category": "desktop_exploration",
    "role": "Mapas bibliométricos y de coautoría, cocitación, coocurrencia y acoplamiento bibliográfico.",
    "interfaces": [
      "desktop"
    ],
    "network_types": [
      "citation",
      "bibliometric",
      "scientific"
    ],
    "scale_profile": "medium_to_large_for_bibliometrics",
    "maturity": "established",
    "cost_model": "freeware_verify_terms",
    "verification_status": "primary_url_selected",
    "source_origin": "user_provided",
    "notes": "Es una opción especializada para mapas de ciencia, no un analizador universal de grafos."
  },
  {
    "id": "orange",
    "name": "Orange Data Mining",
    "url": "https://orangedatamining.com/",
    "primary_category": "desktop_exploration",
    "role": "Flujos visuales de ciencia de datos; puede ampliarse con add-ons relevantes para redes.",
    "interfaces": [
      "desktop_visual_workflow"
    ],
    "network_types": [
      "general",
      "attributed"
    ],
    "scale_profile": "small_to_medium",
    "maturity": "established",
    "cost_model": "open_source",
    "verification_status": "primary_url_selected",
    "source_origin": "user_provided",
    "notes": "Confirmar cuál add-on cubre el análisis de red requerido; el núcleo no sustituye una librería especializada."
  },
  {
    "id": "semspect",
    "name": "SemSpect",
    "url": "https://www.semspect.de/",
    "primary_category": "desktop_exploration",
    "role": "Exploración visual de datos semánticos y grafos de conocimiento.",
    "interfaces": [
      "desktop_or_hosted_verify"
    ],
    "network_types": [
      "knowledge_graph",
      "semantic"
    ],
    "scale_profile": "medium_to_large",
    "maturity": "commercial_or_specialized",
    "cost_model": "verify_current_terms",
    "verification_status": "primary_url_selected",
    "source_origin": "user_provided",
    "notes": "Verificar edición, disponibilidad y condiciones actuales."
  },
  {
    "id": "pajek",
    "name": "Pajek",
    "url": "http://mrvar.fdv.uni-lj.si/pajek/",
    "primary_category": "desktop_exploration",
    "role": "Análisis y visualización de redes grandes, con uso histórico en ciencia de redes.",
    "interfaces": [
      "desktop"
    ],
    "network_types": [
      "social",
      "citation",
      "general"
    ],
    "scale_profile": "large_for_supported_workflows",
    "maturity": "established",
    "cost_model": "freeware_verify_terms",
    "verification_status": "primary_url_selected",
    "source_origin": "curated",
    "notes": "Interfaz y ecosistema distintos a herramientas web modernas; revisar formatos y exportación."
  },
  {
    "id": "yed",
    "name": "yEd Graph Editor",
    "url": "https://www.yworks.com/products/yed",
    "primary_category": "desktop_exploration",
    "role": "Edición de diagramas y layouts de grafos para diagramación estructurada.",
    "interfaces": [
      "desktop"
    ],
    "network_types": [
      "dependency",
      "organizational",
      "process",
      "general"
    ],
    "scale_profile": "small_to_medium",
    "maturity": "established",
    "cost_model": "freeware_verify_terms",
    "verification_status": "primary_url_selected",
    "source_origin": "curated",
    "notes": "Más adecuado para diagramas/representación controlada que para inferencia estadística de redes."
  },
  {
    "id": "graphviz",
    "name": "Graphviz",
    "url": "https://graphviz.org/",
    "primary_category": "desktop_exploration",
    "role": "Renderizado reproducible de grafos mediante el lenguaje DOT y layouts automáticos.",
    "interfaces": [
      "cli",
      "library"
    ],
    "network_types": [
      "dependency",
      "directed",
      "hierarchical",
      "general"
    ],
    "scale_profile": "small_to_large_for_static_rendering",
    "maturity": "established",
    "cost_model": "open_source",
    "verification_status": "primary_url_selected",
    "source_origin": "user_provided",
    "notes": "Fuerte para diagramas reproducibles; no es una plataforma de exploración analítica interactiva."
  },
  {
    "id": "gephi-lite",
    "name": "Gephi Lite",
    "url": "https://gephi.org/gephi-lite/",
    "primary_category": "web_hosted",
    "role": "Exploración de redes desde el navegador con una experiencia ligera vinculada al ecosistema Gephi.",
    "interfaces": [
      "browser"
    ],
    "network_types": [
      "general",
      "social",
      "citation"
    ],